{
  "contract_version": "project-brain-fact-result.v1",
  "fact_id": "governance.work_items.status_counts",
  "classification": "G0",
  "privacy_risk_tier": "not_applicable",
  "status": "Trusted",
  "reason_code": "SYNTHETIC_CONTRACT_FIXTURE",
  "observed_at": "2026-07-17T00:00:00Z",
  "evaluated_at": "2026-07-17T12:00:00Z",
  "window_start": "2026-07-17T00:00:00Z",
  "window_end": "2026-07-17T00:00:00Z",
  "definition_version": "v1",
  "authority_id": "authority.governance.agent_collaboration",
  "source_owner": "平台集成负责人",
  "synthetic": true,
  "sample_size": null,
  "value": {"active": 4, "integrated": 120, "planned": 3},
  "decision_usable": false,
  "checks": {"source_available": true, "freshness": "pass", "quality": "pass", "authorization": "pass", "authority_conflict": false, "privacy_threshold": "not_applicable"},
  "evidence_hash": "aaaaaaaaaaaaaaaaaaaaaaaaaaaaaaaaaaaaaaaaaaaaaaaaaaaaaaaaaaaaaaaa"
}
